cleaned_text,sentimen
hehehe triliun udah mulai receh sekarang mari kita ucapkan selamat datang di era korupsi kuadriliun ininegrikriminal indonesiagelap darkindonesia darkpik,netral
itu kmrn udah berusaha dikoreksi melalui demo indonesiagelap tapi malah lu sepelein dan ga ditanggepin serius emang dasar manusia munafik lu kebanyakan omon omon anjing,negatif
tunggu amuk rakyat aj gara jokowi indonesiagelap srmakin gulita indonesiagelap berlalu jokowi sekeluarga dipenjara bersama dalangnya aguan cs,negatif
tanggapi mega korupsi di pertamina kita bersihkan mbatinku bersihkan ndasmu indonesiagelap,netral
nggak dong mari kita ucapkan selamat datang era korupsi kuadriliun ininegrikriminal indonesiagelap darkindonesia darkpik,netral
langsung main bakar ya setelah byk membakar uang rakyat dgn mengoplos pertalite ke pertamax negeri ini lagi amp sedang terang an memancing emosi rakyat sepertinya tdk takut akn ada gejolak karena sdh lebih dekade rakyat agak kompromi memilih diam wait amp see indonesiagelap,negatif
mulai dari nol ya spbu pertamina pertamax pertalite ron ahok bumn kaburduluaja indonesiagelap aiartcommunity aiart aiartgallery digitalart art digital aivideo clipflyofficial x,netral
oligarking they not like us indonesiagelap darkindonesia adilijokowidodo adilijokowi danantara pertamax pertamina artistbersuara lawanajadulu ahok pepaya bumn erick tohir bahlil koruptor jokowi indonesia korupsi,netral
kami ini minta hak bukannya minta ininegrikriminal indonesiagelap darkindonesia darkpik,netral
gak cuma pejabat yang suka janji palsu tetagga saya penjahit juga sering janji palsu apakah tetangga saya penyumbang tagar indonesiagelap,negatif
di taman lincoln square kota melbourne para mahasiswa indonesia duduk melingkar berdiskusi tentang negeri indonesiagelap menyatakan solidaritas terhadap gerakan yang ada di indonesia dan ingin turut serta secara aktiv menyuarakan ketiadakadilan melbournebergerak,netral
hehehe triliun udah mulai receh sekarang mari kita ucapkan selamat datang kuadriliun ininegrikriminal indonesiagelap darkindonesia darkpik,netral
gelombang demo indonesiagelap makin panas tapi pertanyaannya siapa yang benarbenar diuntungkan apakah ini bagian dari strategi as untuk menjaga pengaruhnya ataukah china yang ingin memperkuat posisinya di indonesia atau justru ada aktor domestik yang memainkan skenario,negatif
ketika para petinggi negara sudah dicekoki anggota kehormatan ormas pembuat resah pengusaha dan rakyat jelata itu mereka tidak akan pernah berani tegas menindak atau bahkan mereka menikmati hasilnya juga indonesiagelap,negatif
darkindonesia darkindonesia cause kentutomonomon indonesiagelap dari petruk di serahkan ke bagong,netral
bakar barbuk yoo emaan to lee indonesiagelap adilijokowi prabowomuridpatuhjokowi,netral
menyangkal isu indonesiagelap dengan membangun narasi ekonomi indonesia bagus daan baikbaik saja dengan mengabaikan harga barang² naik phk marak lapangan kerja sempit dan yang paling terasa itu daya beli masyarakat makin menurun sejak sebelum akhir masa presiden ri ke,negatif
kejaksaan kejar tayang buat naikin survey indonesiagelap kaburajadulu ruukejaksaan kasustimah,negatif
kita tidak percaya pemerintah lagi indonesiagelap,negatif
makin jelas kepentingan siapa indonesiagelap kaburajadulu mahkamaagungbikinresah timah,netral
ini masa depan gua gimana ya anjing kalo masih disini indonesiagelap indonesiagelap,negatif
wahhh jika menko membenarkan tindakan penyerangan bahaya ini indonesiagelap indonesiagelap,negatif
indonesiagelap itu memang benar adanya kita bayar pajak hanya utk bahag pengeluaran super ngehek karena mental korup kpu dan bawaslu daerah supar kamprettt mau diumpetin apa lagi mmg indonesia gelap kannn,negatif
kontol amat jadi negara indonesiagelap,negatif
kasus pengoplosan penipuan konsumen rakyat bbm oleh pertamina dan besar kerugian negara apa kurang terang juga tagar indonesiagelap itu wahai penghuni istana,negatif
kerugian rakyat gak pernah dihitung kenapa ya indonesiagelap,negatif
presiden nya juga palsu oplosan jokowi indonesiagelap,negatif
orang segini banyak gada gitu yang mau bawa molotov ke gedung goverment terdekat indonesiagelap,negatif
parah indonesiagelap,negatif
kongkalikong antara pemerintah baru biar mereka yg nguasain babel abis itu pemain lama dibuang indonesiagelap kaburajadulu kejagungri dominuslitis babel t,negatif
jgn brmimpi mncapai indonesia emas jk korupsi amp kolusi msh merajalela d negeri ini janji hnya omon krn kalo mau mmbrsihkan lantai itu hrs dgn sapu yg baru amp bersih serta mngganti sapu yg lama amp rusak ndasmu indonesiagelap lawanajadulu,negatif
kalau pakai logika kamu udah diperiksa kalau pakai logika kamu ga bakal bisa maju pilpresdi di jangan selalu membodohi masyarakat dengan pembenaran bahasa mu indonesiagelap,negatif
kotornya teramat gawat ya kotornya sangat nyanyian berkarat sampai ke liang lahat busukbusukbusukbusuk bangkai tikus yang mati karena dihakimi rakyat adakah akhirat menerima dirinya indonesiagelap,negatif
indonesiagelap bokap nyokap mereka berdua aktivis nya lulusan ui bokap ft nyokap fisip nikah mereka tunda biar bisa ikut demo bokap akhirnya berhasil dan ikut naik ke atas gedung literally naik ke atas dan berhasil mengibarkan bendera,netral
buat industri males mending tarik di pns katanyah ininegrikriminal daruratkorupsi indonesiagelap darkindonesia darkpik,negatif
kenapa waktu kejaksaan geledah rumah bangsat riza chalid bawa tentara segala emang bekingannya siapa sih indonesiagelap,negatif
daj dijelasin masih aja ngeyel lu emang mau nyari pembenaran doang kok demo menurut lu indonesiagelap tuh cuma demo doang ga keberlanjutan penyelesaian masalahnya yang makin menumpuk tiap hari,negatif
tambah indonesiagelap,positif
indonesia adalah negara berkembang berkembang biak malingnya karena pertamaxoplosan jadilah pertaminasarangkoruptor akibatnya indonesiagelap,negatif
kalo mau sidak bawa ahli atuh ininegrikriminal daruratkorupsi indonesiagelap darkindonesia darkpik,netral
orang bodoh dikasi jabatan indonesiagelap,negatif
dipailitkan saat ted sioeng berada diluar negeri sampai ted tidak punya kesempatan melakukan pembelaan secara hukum mayapadacurang usutmayapada mayapadarentenirelit indonesiagelap pertamax danantara,netral
gerakan mahasiswa mendesak aparat penegak hukum untuk segera memanggil dato sri tahir dan mengusut tuntas semua kejahatan perbankan mayapada mayapadacurang usutmayapada mayapadarentenirelit indonesiagelap pertamax danantara,netral
kirain sinetron beneran tnyata indonesiagelap,positif
gerakan mahasiswa mendesak aparat penegak hukum untuk segera memanggil dato sri tahir dan mengusut tuntas semua kejahatan perbankan mayapada mayapadacurang usutmayapada mayapadarentenirelit indonesiagelap pertamax danantara,netral
dipailitkan saat ted sioeng berada diluar negeri sampai ted tidak punya kesempatan melakukan pembelaan secara hukum mayapadacurang usutmayapada mayapadarentenirelit indonesiagelap pertamax danantara,netral
disuruh nyaman di negri yang sakit hahaha disuruh hormati sila² walaupun beberapa tidak berlaku indonesiagelap indonesiagelap,negatif
indonesia itu terang indonesiagelap indonesiagelap artistbersuara,netral
salah seorang pbh lbh makassar diintimidasi lalu dipiting oleh anggota polrestabes kota makassar pada saat ingin memberikan akses bantuan hukum terhadap massa aksi indonesiagelap peringatadarurat,netral
kalo marah yah benar benar si mulyono yg punya kerjaan nih indonesiagelap,negatif
muka setan indonesiagelap,negatif
anjing kalian jangan bohongi rakyat terus menerus bubarkan saja bubarkanpertamina indonesiagelap,negatif
dengan dipasangnya gambar orang di atas pintu tidak ada yang mau masuk jebakan bisa masuk tidak bisa keluar indonesiagelap fufufafaaibnasional,negatif
ini yg bilang indonesiagelap,negatif
biang kerok indonesiagelap,negatif
siapa yg bilang indonesiagelap kalian tidak bisa melihat betapa cahai itu terang benderang menyinari bumi pertiwi mungkin mata kalian tertutup nafsu angkara hingga terangnya cahaya indonesia kalian tak bisa lihat oooohhh oooooohhhh oohhhh,negatif
mau ga hancur gimana kli seperti ini indonesiagelap,negatif
bangsat aja rusak gini mau suruh lagi simpen emas di bank emasmau kalian rampok juga bubarkanpertamina indonesiagelap,negatif
akhirnya kita sadar bahwa sang mantan memiliki kekuatan yang dahsyat untuk merusak cenasuwok indonesiagelap fufufafaaibnasional,netral
indonesiagelap itu lihat dari mana monggo pak sudah di rangkum warga media mainstream ga bakal ada beginian pak lah kan satu circle,negatif
ndasmu indonesiagelap ada fenomena yang sedang terjadi pada saat ini dalam waktu yang hampir bersamaan yang membuat publik tidak percaya lagi terhadap pemerintah pindah dari bank bumn ke swasta pindah dari spbu pertamina ke shell,negatif
mari hinahina anak bapak ibu dan sekeluarganya uang itu jelas dari pajak rakyat indonesiagelap peringatandarurat,negatif
bangsat bubarkanpertamina indonesiagelap,netral
ngeri ngeri indonesiagelap,negatif
di era indonesiagelap ini semua bisa terjadi semua karna bahlil,netral
diperlakukan seperti handuk dicelub sehari dipalak pajak selama hari indonesiagelap fufufafaaibnasional,netral
presiden ijazah oplosan meninggalkan kerusakan luar biasa buat rakyat bangsa dan negara mana tanggung jawabmu indonesiagelap,negatif
kalau bukti udah banyak liat aja indonesia sekarang ini apakah semangkin maju atau semangkin mundur wkwkwk pantesan aja banyak anak² muda yang pada kabur dari indonesia indonesiagelap kaburajadulu,negatif
ngeliat fakta skrg aja suram kok berharap th lagi terbesar ke korupsi ratusan t seolah ga papa amp kasusnya begitu sja mantan koruptor jd pejabat bahkan pengelola keuangan pengangguran meningkat investor lari bahas yg skrg aja gosah th lg indonesiagelap,negatif
ndasmu nanti arahnya kalo cuma kongkalikong kayak jokowi dan wowo buat apa ga skalian jatah kepresidenan digilir aja antara beberapa keluarga gausah pemiluan bajingan kalian semua indonesiagelap,negatif
reminder yg pertama bikin indonesiagelap,netral
ada dua fenomena yang terjadi saat ini pindah dari bank bumn ke swasta pindah dari spbu pertamina ke shell dua fenomena ini terjadi hampir pada waktu yang bersamaan bahwa pemerintah telah kehilangan kepercayaan dari publik ndasmu indonesiagelap,negatif
bubarkan saja bumn busuk semua indonesiagelap bubarkanpertamina,negatif
