cleaned_text,sentimen
diduga nanti danantara bukan objek penyelengara negara yg tak tersentuh audit dan pertanggung jawaban hukum jika terjadi penyimpangan seperti ini makin indonesiagelap indonesiacemas atau indonesiaterang sieh jangan tanya buzzee selama proyek ada logika kebalik balik,negatif
muka jelek riwayat akademik jelek kebijakan jelek partai jelek akhlak jelek sebagai lulusan ui gue memberikan saran untuk ui lebih baik keluarkan aja si bahlil hanya memberikan citra buruk aja indonesiagelap peringatandarurat,negatif
yg masyarakat indonesia mau itu simpel aja sih ga aneh aneh kok sahkan uu perampasan aset para koruptor sampai dengan korupsi di atas m hukum mati para koruptor dengan korupsi di atas m indonesiagelap,negatif
danantara komplotan koruptor indonesiagelap viral viralindo viralterbaru,netral
darkindonesia darkindonesia cause kentutomonomon indonesiagelap muke paling afdol kalo digebukin se indonesia,netral
kejaksaan kejar tayang buat naikin survey indonesiagelap kaburajadulu ruukejaksaan kasustimah,negatif
kadang berfikirbangsa kita manage sampah rumah tangga aja belum bisaskrg mau manage investasi danantarabeneran ta ini danantara vina indonesiagelap,negatif
indonesiagelap bangsa indonesia sedang mengalami krisis definisi energi nasional bumn swasta koperasi mangkrak ruu koperasi berprinsip my planningprocesses macet inefficiency rpp kebijakan energi nasional,netral
gelo langit semarang gelap banget malem ini sambutan untuk indonesiagelap kah,negatif
real sampe buat tandingan semu liat aja bahkan mereka mau nyamain dresscode demo indonesiagelap cc,negatif
akhirnya darius join lawan pejabat koruptor rezimkoruptor indonesiagelap,negatif
perjuangan belum selesai indonesiagelap,negatif
penghilangan barbuk di pertamina yang disidak dpr ri malah shell wkwkwkwkwk lawak pertaminapenipu indonesiagelap,negatif
kasus pertamax kalau ditotal hampir kuadriliun itu baru dari perusahaan bumn apakabar itu danantara yg akan mengelola semua aset negara apakah akan terus menghancurkan negeri demi memperkaya diri pertamax indonesiagelap,negatif
parade senja tiba tiba mati lampu sangat memalukan indonesiagelap,negatif
ga bisa di samain bang makanya bener tuh indonesiagelap,negatif
semogaa bisa yaa nunggu si gendut iu turun jabatan karna klo masi dia yg menjabat rasanya mustahil indo bisa maju indonesiagelap,negatif
makin jelas kepentingan siapa indonesiagelap kaburajadulu mahkamaagungbikinresah timah,netral
tokoh terkorup dunia dipiara pemerintahan saat ini indonesiagelap,negatif
mulyono tau tapiwe know laaaa indonesiagelap indonesiagelap,netral
tolak mbg mk coco ikutan demo indonesia gelap ongezellig indonesiagelap,netral
bali indonesiagelap,positif
terus bagaimana membuat mempertanggungjawabkan semua itu pdip sebagai partai pengusung juga sudah memecat jokowi jadi dari avenue mana jokowi bisa dihukum ugm sebagai institusi yang diperalat namanya mungkin bisa menuntut tapi apakah mau indonesiagelap,negatif
aneh nya negara menipu rakyatnya indonesiagelap,negatif
tps pilkada se indonesia ternyata harus diulang biaya siapa rakyat lah dari mana duitnya entahlah indonesiagelap darkindonesia check out deddysitoruss video tiktok,netral
yg daerahnya ada spbu non plat mrh selamat ya spbu pindah ke swasta dana di himbara pd pindah jg le swasta nanti apalagi begini msh denial kl indonesiagelap,netral
tapi mahkamahnya mk paman percumaaaaa indonesiagelap indonesiagelap,negatif
harusnya erick juga bertanggung jwb atas kejadian ini ini korupsi besar²an duit rakyat hanya dinikmati sendiri bersama keluarga kolega dan kerabatnya indonesiagelap hukum dipermainkan oleh rezim abal abal,negatif
aduhhhh ini benar² indonesiagelap jadi gelap gara² nih orang,negatif
pernikahan selama belasan tahun berakhir begitu saja apa alasan sebenarnya fakta mengejutkan terungkap asricerai faktamengejutkan beritaviral rumahtangga trendingnow indonesiagelap kaburajadulu pertamax pertamina pertalite spbu mygoldenblood,netral
untuk memuluskan proyek china one belt one road betulkan pak masak anda diam aja sejengkal nkri dirampas kalau direbut paksa kembali aja gimana setuju gak kalau gak di bombardir aja pik amp indonesiagelap luhut,negatif
makanya keliatan kan yg demo mahasiswab ori sama yg bayaran itu jelas bayaran orang indonesiagelap,negatif
indonesiagelap buat rakyat tapi terang benderang buat pejabat korupkroni,negatif
hahaha puji bahlil indonesiagelap,positif
breaking news kilang minyak cilacap terbakar wownegara bakal merugi lagibukan cuma kerugian efek korupsi tapi jg efek percikan api hmmmmmm pen curiga tapi takut sama kang siomay depan rumah indonesiagelap,negatif
gelap gelap dah indonesiagelap,negatif
ada multiple orgasme dooong indonesiagelap indonesiagelap,netral
alangkah baiknya presiden dan membuat uu baru tentang korupsi bab i ayat pelaku korupsi di pelihara oleh negara indonesiagelap,negatif
belum oplos jadi pertamax tapi tangki pertalite di area lomanis kilang pertamina cilacapjawa tengah terbakar kerugian negara ulah babi ngepet direksi pertamina pun rp triliun bukan rp triliun indonesiagelap indonesiacemas,negatif
anjir begitu bahagianya jadi pejabat di negeri konoha ini pak warga tertindas tetap aka oke gaez oke gaez indonesiagelap,negatif
dari kepala sampai ekor korupsi semua gaess emang bener bener negara ini hancur dari segala aspek indonesiagelap indonesiacemas korupsi kotacirebon pdam,negatif
seperti becus indonesiagelap indonesiagelap,negatif
negri sdh merdeka indonesiagelap adilijokowi,netral
ton dibagi buat elite dan keluarga saja masih kurang waduh indonesiagelap,negatif
liat rakyat mu pak kebutuhan dasar dulu baru investasi indonesiagelap indonesiakasian danantarakonspirasijahat tolakdanantara pagarlaut,netral
negri sdh merdeka indonesiagelap adilijokowi,netral
boro diperlakukan begitu disini semua aja di pajakin indonesiagelap indonesiacemas,negatif
kata di kabinetnya orang² hebat bro bukankah salah satu nya ndasmu indonesiagelap adilijokowihargamati,positif
numpang spotlight di kolom komentar coba refleksi minggu terakhir apa yang lenyap oh ya pagar laut ilang danantara hampir hilang demo indonesiagelap juga ilang,negatif
jangan main tapi sungkem dulu sama sang raja korup dan gratifikasi sepanjang masa indonesiagelap,negatif
lah terus ron berapa indonesiagelap pertaminasarangkoruptor pertamaxoplosan pertamax pertamaxpertalite pertalite tanpa antri,negatif
gw inget nyumpahin sby gara century t dan perang komen di komentar ternyata itu sudah jauh terlewati seakan akan udah beda jaman indonesiagelap,negatif
hidup jokowi hidup jokowi hidup jokowi ndasmu indonesiagelap,positif
update dpt tsk baruperkiraan capai lbh dr t gilak aja dah awowkwkwowk indonesiagelap,negatif
update dpt tsk baruperkiraan capai lbh dr t gilak aja dah awowkwkwowk indonesiagelap,negatif
rakus indonesiagelap,negatif
tolak proyek ikn kalimantan tolak amp tolak pemindahan ibukota negara indonesia dengan secepat nya amp sekarang dki jakarta tetap ibukota negara indonesia nkri adilijokowi adiliaguan indonesiagelap reformasipolri copotampgantipimpinankpk bayarpolisi,netral
gak usah dituntut aja pak jaksa biar rakyat gak bingung siapa yang dibantu dan disubsidi pemerintah lewat pertamina indonesiagelap kaburajadulu,negatif
negri sdh merdeka indonesiagelap adilijokowi,netral
tolak amp tolak proyek pik yang ber kedok psn dengan secepat nya amp sekarang adilijokowi indonesiagelap tangkap amp adili jokowi aguan cs ganyangfufufafa ganyangkoruptor hukummatidanmiskinkankoruptor indonesiamilikamppunyarakyat makzulkanfufufafa,negatif
negri sdh merdeka indonesiagelap adilijokowi,netral
ini orang airlangga bahlil budi arie adalah kriminal terbesar di kementrian indonesiagelap,negatif
borok si bajigur tulul sebiji demi sebiji mulai terungkap berapa zohlimnya dia sbg plersinden cenasuwok indonesiagelap,negatif
indonesiagelap program makan siang gratis menyita apbn,netral
dengerin nih indonesiagelap indonesiakasian danantarakonspirasijahat tolakdanantara pagarlaut,netral
astaga masih aja satuharisatupolisijahat di kala indonesiagelap ini,negatif
pematerinya aja bermasalah mau jadi apa negara ini indonesiagelap,negatif
kata siapa pea itu menteri banyak yg korup aman bae indonesiagelap,negatif
pemadaman listrik berulang lagi mau sampai kapan sudah ada tahun lebih sampai tangan kamu putus pastinya insyaalloh tidak bakalan berkah pertamax pepaya indonesiagelap,negatif
semua permasalahan kelar klo duit negara ga kena korup mulu mah ga ada tuh efisiensi efisiensi kentuttt,negatif
kan menurut gw kmrn kita demo nih udh satu aja dulu permasalahan utama nya adain uu hukuman mati buat pelaku korup tanpa ampun pkok nya diatas m hukum mati di atas triliun hukuman mati buat satu keluarga ny g ada yg bkal berani cok korap korup sebegitu bnyk ny iblis,negatif
artistbersuara indonesiagelap amburadul abis pertamina apa lagi kira,negatif
ini bahan bacaan yang vibesnya kaya baca dongeng,positif
bener biadab indonesiagelap adili,negatif
msh lama pergantian presiden udh ga betah dng situasi amp kondisi skrng fix pilih yg berkualitas amp berahlak biar negri ini bisa bebas dr koruptor omon indonesiagelap,negatif
cakeeep daftarnya bukti nyata indonesiagelap,positif
hiswana migas selaku fasilitas spbu jg diam saja indonesiagelap,negatif
kasus oplosan pertamax peran pengawasan bp migas kemana ya dr lalu yayasan perlindungan konsumen kok diam aja ya tidak ada gebrakan ny indonesiagelap,negatif
apa yg perlu kita tuntut kepada pemerintah amp apa pula yg perlu kita kerjakan bersama selengkapnya di keeptalking eepsaefullohfatah indonesiagelap peringatandarurat prabowo gibran efisiensianggaran proyekstrategisnasional makanbergizigratis,netral
negri sdh merdeka indonesiagelap adilijokowi,netral
kapan bisa dibikin sadar kalau dia sudah bukan presiden ya dia masih pakai lambang kepresidenan di baju nya post power syndrom akut kayaknya ini azab untuk dia atau untuk kita ya indonesiagelap,negatif
trust issue pemerintah kerjanya ga bener indonesiagelap,negatif
indonesiagelap auahgelap,negatif
pinter keblinger yo ngene ki udah enak enak gaji ber m m masih aja nyari celah buat memperbanyak pundi astaga negeriku penuh orang kek gini indonesiagelap,negatif
sabar sabar batubara sedang anjlok hancur harganya mungkin efek indonesiagelap,negatif
biasanya gelap kaya indonesiagelap yak,negatif
ternate mahasiswa dan jurnalis dipukul satpol pp saat aksi indonesiagelap,netral
member exabet cuan setiap hari pertaminasarangkoruptor pertamax pertalite korupsipertamina pepaya liverpool exabet slotgacor cewekmontok bumn ahok arsenal pertegashukumindonesia indonesiagelap indonesianidol,netral
negara hemat anggaran masalah rokok dibiarkan pemangkasan anggaran yang signifikan akan berisiko menghambat langkahlangkah penting yang dibutuhkan di bidang kesehatan sobat str tulis solusi dan pendapat kalian di kolom komentar yaaa indonesiagelap suaratanparokok,netral
nikmat mana lagi yang engkau dusta kan indonesiagelap,negatif
kenapa ga tat tet tot tat tootttttttt tettt nguing nguing aja sih kayak di indonesiagelap salam ga respek dr konoha,negatif
kemaren isu pagar laut kementrian atrbpn kebakatan sekarang kasus pertamina dengan kerugian ratusan triliun kebakaran juga di negeri konoha ini sudah tersedia template untuk mengaburkan kasus atau isu korupsi besar indonesiagelap,negatif
baca nih pak biar efisien sesuai dgn program lu pak suruh tidur tinggal kasih makan kasih baju kasih cemilan kasih kamar di istana negara indonesiagelap indonesiabubar,netral
sudah betul demo kemarin dengan indonesiagelap,netral
pov saya dan kalian ketika terpaksa beli pertamax sebelum kasus korupsi terungkap viralindo pertamaxoplosan pertamaxpertalite indonesiagelap capek,negatif
palzu nih frend kamuh jendral bernyali ga minta pertanggungjawabannye indonesiagelap adil,negatif
woee rakyat waras dikitlah udah taukan ini negara maling proyek negara yg duitnya jelas ga terbayar jg pada bnyak kontraktor sampe ada yg bundir dan strok waras waras woee indonesiagelap,negatif
tadi hampir ngomel karna jalannya dialihin kirain karna ada pejabat tai mau lewat oh ternyata ada demo di dprdsemangatt guyssss indonesiagelap,negatif
salahnya negara juga knpa ron dihapus yg pnya nilai ekonomis akhirnya dimanfaatkan oleh para anjg babi bajingan bangsat ini lalu dijual seharga rb indonesiagelap,negatif
update dari makassar tim lbh makassar diintimidasi dan dipiting dari anggota polrestabes makassar ketika hendak memberikan akses bantuan hukum terhadap massa aksi indonesiagelap yang ditahan pada,netral
indonesia masih begini aja nggak mau bubar aja apa indonesiagelap prabowo,negatif
aksi masa aliansi mahasiswa dan rakyat sipil di kota bengkulu bumi raflesia melawan kembali memakan korban dari represifitas aparat dalam aksi indonesiagelap terdata ada orang yang menjadi korban dari kekerasan oknum kepolisian,netral
padahal dah taunslamat datang d era korupsi kuadriliun ininegrikriminal indonesiagelap darkindonesia darkpik,netral
padahal dah taunslamat datang d era korupsi kuadriliun ininegrikriminal indonesiagelap darkindonesia darkpik,netral
garudamerah putih diselimuti kegelapan indonesiagelap,netral
indonesiagelap kalau masih terang matanya sering lah melihat keadaan ralyat kecil,negatif
tangkap bambang hero pembuat masalah di babel tangkapbambanghero adilioknum kejagungri dominuslitis indonesiagelap,netral
slamat datang d era korupsi kuadriliun ininegrikriminal indonesiagelap darkindonesia darkpik,netral
slamat datang d era korupsi kuadriliun ininegrikriminal indonesiagelap darkindonesia darkpik,netral
slamat datang d era korupsi kuadriliun ininegrikriminal indonesiagelap darkindonesia darkpik,netral
makanya kalau ada berita demo itu insan pers jangan hanya diam seperti takut sama rezim penguasa indonesiagelap malah disiarkan oleh media asing jika bersih kenapa risih,negatif
kasus korupsi pertamina dibongkar trus gabung danantarabiasalah jadi pahlawan kesiangan kode keras indonesiagelap danantara pertama pertaminasarangkoruptor,negatif
warisan mulyono janji besarkan pertamina kalahkan petronas pertamina diprediksi bangkrut karena pemerintahan jokowi pinjam uang pertamina rp triliun korupsi pertamax ditaksir rp triliun masih sangkal indonesia gelap nalar indonesiagelap,netral
ayo rame hukum rezim ini indonesiagelap,negatif
orang ini jadi sumber indonesiagelap indonesiagelap,negatif
tabrak aturan sama yg buat aturan emang kacau kejaksaaneror revisiuukejaksaan indonesiagelap kaburajadulu bubarkankejaksaan,negatif
mak gw clueless bgt sm indonesiagelap trs gw gatau ngejelasinnya gmn krn udh keburu cape,negatif
kongkalikong antara pemerintah baru biar mereka yg nguasain babel abis itu pemain lama dibuang indonesiagelap kaburajadulu kejagungri dominuslitis babel t,negatif
sering jadi pengalihan berita tangki cilacap di bakar tidak salah lagi beberapa tahun lalu di bakar juga tangki di cilacap indonesiagelap indonesiagelap,netral
februari dengan berbagai macam insiden gas mana gas kaburajadulu indonesiagelap danantara pertamax dioplos,netral
sabarr bener ya rakyat nkri menghadapi kelakuan pejabatnya tau pada mati sendiri rakyatnya indonesiagelap revolusihargamati,negatif
itungan t itu gak ada dasarnya kok bisa sebesar itu indonesiagelap kaburajadulu t timah kejagung,negatif
indonesiagelap gulita sampe dokter jiemi dah ngetweet kek gini,negatif
iya padahal dah taunslamat datang d era korupsi kuadriliun ininegrikriminal indonesiagelap darkindonesia darkpik,netral
indonesiagelap pake banget,negatif
iya dah tayn dan slamat datang d era korupsi kuadriliun ininegrikriminal indonesiagelap darkindonesia darkpik,netral
monmaap gue mah dah sering ribut sama bapak sendiri tp kan gamungkin kita sampe musuhan ya kan grgr dia pendukung wowo pernah tuh pas indonesiagelap demo kmrn dia ngomong gini doakan saja pemimpin negri saat ini agar sehat selalu agar bisa menghasilkan keputusan baik,negatif
slamat datang d era korupsi kuadriliun ininegrikriminal indonesiagelap darkindonesia darkpik,netral
baru backbacknya penyerang sama pelatihnya belum apalagi pemilik klub indonesiagelap indonesiadaruratkorupsi,negatif
iya bang dah taun ininegrikriminal indonesiagelap darkindonesia darkpik,netral
terpantau sdh sepi dan mari kita semua pindah ke motdar luh anj maling penipu bajingan bangsat bubarkan pertamina indonesiagelap,negatif
jaket bomber pria military bahan taslan waterproof furing dalam menggunakan dakron varian size m xl harga dm bumn danantara pertamina pertalit pertamax ron pertaminasarangkoruptor indonesiagelap,netral
lholho kok bisa pas gitu ya momennya yang kek ginigini nih bikin indonesiagelap,negatif
jaket windbreaker hoodie unisex bahan wp despo furing jaring nyaman digunakan untuk segala kebutuhan varian size m xl harga dm bumn danantara pertamina pertalit pertamax ron pertaminasarangkoruptor indonesiagelap,netral
suka sukalah mau dibuat berapa t semakin besar semakin bagus untuk pencitraan prabowo biar dia bisa tampil seperti superman yang berhasil menangkap penjahat besar ini juga bisa jadi pengalih isu yg bagus dari karut marut pemerintahan prabowo yang bikin indonesiagelap,negatif
delusi kesejahteraan indonesiagelap ketika seorang pemimpin negara dengan percaya diri menyatakan bahwa tahun lagi indonesia akan melampaui jepang dan prancis pernyataan itu lebih terdengar sebagai delusi daripada visi,negatif
???????????????????? ???????????? ?????????? ?????????????????? ?????????????????? ???????????????? ???????????????? jangan hina kecerdasan publik dengan kebahlulan pejabat indonesiagelap adilijokowi,negatif
pantes gelap ternyata aph nya juga bersikap gak jelas indonesiagelap kaburajadulu timah babel,negatif
efisiensi anggaran bukan hanya soal pengurangan biaya tetapi juga tentang bagaimana setiap rupiah digunakan untuk mencapai hasil yang maksimal informasi selengkapnya tentang draft kajian ini dapat diakses pada link berikut indonesiagelap,netral
bersih pakai sapu kotor tolol indonesiagelap adilijokowi,negatif
sudah ngomong gak berani jawab itu lah si bambang hero kejagung t indonesiagelap kaburajadulu revisiruukejaksaan,negatif
makin makin deh indonesiagelap beneran,negatif
demo indonesiagelap di samarinda,netral
indonesiagelap kuatir kegelapan ketek,negatif
jelas dan terang beneran jika kasus ini memang ada muatan politik indonesiagelap revisiuukejaksaan kaburajadulu timah kejagungmainkayu,negatif
akibat kasus itu rakyat babel jadi korban kejagungmainmain t indonesiagelap kaburajadulu revisiruukejaksaan,negatif
bener indonesiagelap,positif
banyaknya kasus korupsi di bumn seperti pertamina kenapa mentrinya nggk di pecat atau setidaknya mengundurkan diri indonesiagelap,negatif
ijazah palsu presiden palsu pertamax palsu indonesiagelap,negatif
jaket aquatech waterproof hoodie bahan taslan waterproof furing jala dryfit enak dan nyaman dipakai varian size m xxl harga dm bumn pertamina pertalit pertamax ron danantara pertaminasarangkoruptor indonesiagelap,positif
kabar kawan tim bantuan hukum dari lbh makassar mendapatkan tindak represif diintimidasi dan dipiting dari anggota polrestabes makassar ketika hendak memberikan akses bantuan hukum terhadap massa aksi indonesiagelap yang ditahan pada cc ig lbh makassar,netral
gila saya udah ga percaya apapun yg keluar dari mulut jokowi kalo pun dia kebelet eek pun keknya saya juga bakal percaya dengan mudahnya indonesiagelap,negatif
rakyat yang masih miskin vs para pemain politik yang jahat dan serakah kombinasi yang epic untuk indonesiagelap,negatif
yg ada hubungannya dgn pdip serang begitu perintah kakak pembinanya termul indonesiagelap,negatif
pantas saja tdk ada pemangkasan di sektor pertahanan agar mrk tetap punya duit utk melangsungkan operasi militer duit otsus dan hak rakyat dipangkas agar tni bisa terus beroperasi melakukan kekerasan pada masyarakat papua indonesiagelap papuagelapbanget,negatif
apa yg dinikmati oleh rakyat indonesia dari kabinet gemuk prabowo banyak rakyat miskin jt orang anak indonesia kelaparan tiap hari korupsi meraja lela dimana mana hutang menumpuk pdb per kapita tdk naik dst indonesiagelap bajingan tolol jilid,negatif
indonesiagelap yang terang hanya cinta ku padamu,positif
rakyat akhirnya menetapkan keputusan yg baik setelah bertahuntahun dikibuli oleh penguasa dan pejabatnya jangan terusterusan mempermainka masyarakat ingat ada batasan emosi rakyat jangan buat mereka bergerak bersama seperti sapu lidi indonesiagelap,negatif
bukan hanya minuman yg memabukan pertamax oplosan pun memabukan indonesiagelap,negatif
negri sdh merdeka indonesiagelap adilijokowi,netral
keanehan dinwgara ya giniii indonesiagelap kaburajadulu surveyrendah timah harveymoeis pelantikanserentak,netral
negri sdh merdeka indonesiagelap adilijokowi,netral
indonesiagelap ke mana hilangnya pantai di labuan bajo flores,netral
negri sdh merdeka indonesiagelap adilijokowi,netral
udah bayar pajak buat para pejabat negara tapi giliran rakyat ada masalah malah disuruh ngatasin sendiri pejabat negara saat ini pada ngapa dah indonesiagelap pastiadajalan,negatif
negri sdh merdeka indonesiagelap adilijokowi,netral
mantan presiden saja bisa dan berhasil membangun dinasti politik kenapa ngak dicoba aja sekalian mumpung kekuasaan lagi dalam genggaman mungkin beginilah pikiran kawan ini satu hal yg terlihat dari kawan ini adalah mempertontonkan keserakahan indonesiagelap,negatif
baru juga mau bulan kok udah banyak banget masalah yah ini negara menteri warisan mulyono emang geh beda indonesiagelap kaburajadulu kimplus ruukekaksaan prabowogibran harikerja,negatif
keanehan dinwgara ya giniii indonesiagelap kaburajadulu surveyrendah timah harveymoeis pelantikanserentak,netral
jika tak mau disebut omon bersihkan dulu menteri yg bermasalah dan adilijokowi indonesiagelap,negatif
sling bag lexus waterproof bahan bimo waterproof simple dan elegant harga dm bumn pertamina pertalit pertamax ron pertaminasarangkoruptor indonesiagelap,positif
emang indonesiagelap,negatif
ndasmu malu gue punya wapres termuda dan terusak parah begini dijadiin negara seperti mainan nya lengserkangibran adilijokowidodo indonesiagelap peringatandarurat batalkandanantara,negatif
tadi liat postingan ini imo beliau ini emang lgi nyari calon yg berpotensi utk kedepannya supaya bisa milih dia nantinya nah dibentuklah citranya dari sekarang emang udah disusun rapi gituloh gws indonesiagelap adilijokowi,positif
ndasmu indonesiagelap,netral
setan saja sdh takut amp muak melihat mereka tdk ada jalannya bagi mereka itu takut tuhan faktanya memang mengerikan tapi kita memang hrs terima kenyataan ini sekarang apakah kita melihatnya biasa saja atau marah dgn keadaan ini kalau marah kita masih waras indonesiagelap,negatif
kebiasaan bohong dari presiden sampai pejabatnya rakyat dibohongin terus suram indonesiagelap,negatif
spbu di indonesia selain pertamina alternatif untuk konsumen yang mulai beralih spbualternatif bensinoplosan shellindonesia bpindonesia vivo hargabbm spbu bbmnaik bbmbagus spbubest bensinmurah jakarta indonesiagelap,netral
kasus ini menunjukkan bahwa dalam sistem hukum kita ada ruang besar bagi ketidakadilan yang berpotensi merugikan siapa saja termasuk harvey moeis indonesiagelap hanyamimpi hariprabowogibran kabinetgemuk harveymoeis,netral
kak sorry buat respect untuk hastag indonesiagelap yang lagi diperjuangkan sama aku dan sebagian masyarakat indonesia malam ini aku nggak spam hastag buat kamu dulu ya tapi tetep aku dengerin kok,positif
negara ini sedang tidak baik baik saja indonesiagelap hanyamimpi hariprabowogibran kabinetgemuk harveymoeis,negatif
menuju indonesiagelap,positif
artist juga bisa artistbersuara indonesiagelap,netral
masih kuraaang tambah lagi dong indonesiadaruratkorupsi indonesiagelap,negatif
gelombang demo indonesiagelap makin panas tapi pertanyaannya siapa yang benarbenar diuntungkan apakah ini bagian dari strategi as untuk menjaga pengaruhnya ataukah china yang ingin memperkuat posisinya di indonesia atau justru ada aktor domestik yang memainkan skenario,negatif
kata kata hari ini pak sueeeeb adilijokowi indonesiagelap,netral
sebenarnya bukan ketutup sih mmg negara ini ngga kekurangan kasus aja akibat ditinggalkan rezim sebelumnya maka itu apapun makanannya minumnya tetap teh btol apapun kasusnya tagarnya tetap indonesiagelap,positif
astaghfirullahalazim ternyata benar indonesiagelap indonesiagelap,negatif
itu biasa becermin dari wapres yg sangat luar biasa hal kerusakan moral mendasar weca indonesiagelap,negatif
negri sdh merdeka indonesiagelap adilijokowi,netral
siap kita ucapkan selamat datang di era korupsi kuadriliun ininegrikriminal indonesiagelap darkindonesia darkpik,netral
siap kita ucapkan selamat datang di era korupsi kuadriliun ininegrikriminal indonesiagelap darkindonesia darkpik,netral
siap kita ucapkan selamat datang di era korupsi kuadriliun ininegrikriminal indonesiagelap darkindonesia darkpik,netral
selama masih hidup mulyono kayak nya akan tetap indonesiagelap,negatif
siap kita ucapkan selamat datang di era korupsi kuadriliun ininegrikriminal indonesiagelap darkindonesia darkpik,netral
ya ampun baru beli kemarin udah merah semua ini keseeeel indonesiagelap,negatif
hampir kualitas amp kecerdasan menteri dan wakil menteri kabinet prabowo setara gibran indonesiagelap,netral
negeri ini lagi amp sedang terangterangan memancing emosi rakyat sepertinya tidak takut akan ada gejolak karena sdh lebih dua dekade rakyat seolah kompromi memilih diam juga wait amp see indonesiagelap pejabatkorupsi pejabatserakah indonesiadaruratkorupsi indonesiasakit,negatif
modus perampokan baru hatihati indonesiagelap,negatif
indonesiagelap ngeriiii,negatif
selamat datang di orde terbarukan indonesiagelap,netral
kasus pengoplosan ialah bentuk pengalihan isu persoalan yang lebih penting aksi demo indonesiagelap mbg kita semua korban dan pentingnya menentukan pimpinan yang adli kini telah hadir almahdi yang membawakan keadilan serta kemanusiaan dibumi,negatif
bawa ahli dong sidak kok kaya gitu ininegrikriminal indonesiagelap darkindonesia darkpik,netral
ngga salah nih bener yeee indonesiagelap,positif
